{
  "$schema": "https://json-schema.org/draft/2020-12/schema",
  "$id": "https://pbs-bureau.dev/fresh-plan/schemas/event.schema.json",
  "title": "Event",
  "description": "Formal schema for an event per D10 (event kind) + D23 (work-unit-id slot addition). Events form the workspace's single ordered chain of attribution-bearing happenings (D10). This schema validates the event envelope; per-payload-subtype payload schemas are layer-3 follow-on (core subtypes' payload shapes documented in D10; extension-registered subtypes' payloads validated by their declaring extension per D29). Notation: JSON Schema Draft 2020-12 per D28. Layer-3 formal schema per D11. Cross-kind referential integrity (e.g., that actors[].id resolves in workspace.composition.actors; that work-unit-id resolves) is out of scope per D28.",

  "type": "object",
  "required": ["id", "prev-event", "timestamp", "actors", "payload-subtype", "payload"],
  "additionalProperties": false,
  "properties": {
    "id": {
      "$ref": "#/$defs/kebab-id",
      "description": "Unique within the workspace (D10)."
    },
    "prev-event": {
      "oneOf": [
        { "type": "null" },
        { "$ref": "#/$defs/kebab-id" }
      ],
      "description": "Reference to the prior event in the workspace's chain (D10). null only for the workspace's first event ever."
    },
    "timestamp": {
      "type": "string",
      "format": "date-time",
      "description": "When the event happened (D10). ISO-8601 UTC."
    },
    "actors": {
      "type": "array",
      "minItems": 1,
      "description": "At least one actor reference per D10 + D9. Role-tag vocabulary is shape policy, not part of the event kind.",
      "items": {
        "type": "object",
        "required": ["id"],
        "additionalProperties": false,
        "properties": {
          "id": { "$ref": "#/$defs/kebab-id" },
          "role": {
            "$ref": "#/$defs/kebab-id",
            "description": "Optional shape-declared role-tag (e.g., drafter, attester, reviewer)."
          }
        }
      }
    },
    "payload-subtype": {
      "$ref": "#/$defs/payload-subtype-identifier",
      "description": "Either a core payload-subtype (D10: claim, action, state-change, composition-change, lifecycle-transition) or a fully-qualified extension-registered subtype per D29."
    },
    "payload": {
      "type": "object",
      "description": "Subtype-specific structure (D10). Framework-core validates the five core subtypes' payload shapes (per-subtype schemas = layer-3 follow-on); extension-declared subtypes are validated by their declaring extension per D29."
    },
    "work-unit-id": {
      "oneOf": [
        { "type": "null" },
        { "$ref": "#/$defs/kebab-id" }
      ],
      "description": "Optional reference to the work-unit (D20) the event is associated with (D23 added this slot). null when the event is not work-unit-associated (e.g., workspace-level lifecycle events)."
    }
  },

  "$defs": {
    "kebab-id": { "type": "string", "pattern": "^[a-z][a-z0-9-]*$", "minLength": 1 },
    "qualified-identifier": {
      "type": "string",
      "pattern": "^[a-z][a-z0-9-]*:[a-z][a-z0-9-]*$"
    },
    "payload-subtype-identifier": {
      "oneOf": [
        {
          "type": "string",
          "enum": ["claim", "action", "state-change", "composition-change", "lifecycle-transition"]
        },
        { "$ref": "#/$defs/qualified-identifier" }
      ]
    }
  }
}
